seed_type,category,title,doi,rationale,role
framing_review,pathogenesis_and_immunology,Role of the innate and adaptive immune responses in the course of multiple sclerosis,10.1016/s1474-4422(14)70305-9,Neuroimmunology depth supplement for Topic 2. Canonical mechanistic review covering Th1/Th17 T-cell subsets B-cell roles beyond antibody production and microglial activation. Recommended for readers needing mechanistic depth beneath the pathology layer.,score_only
framing_review,clinical_care_and_management,Diagnosis of multiple sclerosis: 2024 revisions of the McDonald criteria,10.1016/s1474-4422(25)00270-4,2024 McDonald criteria update adding central vein sign paramagnetic rim lesions and kappa free light chains. Immediate follow-on to Topic 1B seed (2017 criteria). Read together as a pair.,score_only
framing_review,clinical_care_and_management,Multiple sclerosis,10.1016/s0140-6736(21)00478-x,Banwell et al. 2022 Lancet comprehensive review. Most recent broad update covering pediatric alongside adult MS. Living companion to Topic 12A pediatric criteria paper.,score_only
framing_review,epidemiology_and_population_health,Population-based estimates for the prevalence of multiple sclerosis in the United States by race ethnicity age sex and geographic region,10.1001/jamaneurol.2023.1135,Hittle et al. 2023 national US prevalence estimate with geographic stratification. Recommended corpus complement for Topic 13 equity coverage alongside both Langer-Gould seeds.,score_only
framing_review,pathogenesis_and_immunology,Epstein-Barr virus as a leading cause of multiple sclerosis: mechanisms and implications,10.1038/s41582-023-00775-5,Mechanistic bridge from Topic 4A epidemiological finding (Bjornevik 2022) to proposed pathogenic mechanisms. Covers molecular mimicry EBNA1 and implications for vaccine-based prevention.,score_only
framing_review,clinical_care_and_management,Multiple sclerosis progression: time for a new mechanism-driven framework,10.1016/s1474-4422(22)00289-7,Conceptual bridge between Topics 8 (smoldering MS) and 15 (emerging frontiers). Argues for mechanism-driven framework replacing phenotype-based classification — directly complements Louapre 2025 reclassification seed.,score_only
framing_review,imaging_and_biomarkers,Imaging chronic active lesions in multiple sclerosis: a consensus statement,10.1093/brain/awae013,Consensus on imaging methodology for chronic active lesions — directly relevant to Topic 5B paramagnetic rim lesion seed (Absinta 2019) and the 2024 McDonald criteria update.,score_only
framing_review,clinical_care_and_management,Paediatric multiple sclerosis and antibody-associated demyelination: clinical imaging and biological considerations for diagnosis and care,10.1016/s1474-4422(20)30432-4,Companion to Topic 12 pediatric seeds. Covers ADEM MOGAD NMOSD differential with updated imaging criteria; bridges diagnostic criteria (12A) with contemporary clinical management.,score_only
